{
  "$schema": "http://json-schema.org/draft-04/schema#",
  "additionalProperties": false,
  "properties": {
    "application": {
      "additionalProperties": false,
      "properties": {
        "architecture": {
          "type": "string"
        },
        "buildId": {
          "pattern": "^[0-9]{10}",
          "type": "string"
        },
        "channel": {
          "type": "string"
        },
        "displayVersion": {
          "pattern": "^[0-9]{2,3}\\.",
          "type": "string"
        },
        "name": {
          "type": "string"
        },
        "platformVersion": {
          "pattern": "^[0-9]{2,3}\\.",
          "type": "string"
        },
        "vendor": {
          "type": "string"
        },
        "version": {
          "pattern": "^[0-9]{2,3}\\.",
          "type": "string"
        },
        "xpcomAbi": {
          "type": "string"
        }
      },
      "required": [
        "architecture",
        "buildId",
        "channel",
        "name",
        "platformVersion",
        "version",
        "vendor",
        "xpcomAbi"
      ],
      "type": "object"
    },
    "clientId": {
      "pattern": "^[a-fA-F0-9]{8}-[a-fA-F0-9]{4}-[a-fA-F0-9]{4}-[a-fA-F0-9]{4}-[a-fA-F0-9]{12}$",
      "type": "string"
    },
    "creationDate": {
      "pattern": "^[0-9]{4}-[0-9]{2}-[0-9]{2}T[0-9]{2}:[0-9]{2}:[0-9]{2}\\.[0-9]{3}Z$",
      "type": "string"
    },
    "id": {
      "pattern": "^[a-fA-F0-9]{8}-[a-fA-F0-9]{4}-[a-fA-F0-9]{4}-[a-fA-F0-9]{4}-[a-fA-F0-9]{12}$",
      "type": "string"
    },
    "payload": {
      "additionalProperties": false,
      "properties": {
        "scalars": {
          "properties": {
            "content": {
              "additionalProperties": {
                "type": [
                  "integer",
                  "string",
                  "boolean"
                ]
              },
              "type": "object"
            },
            "parent": {
              "additionalProperties": {
                "type": [
                  "integer",
                  "string",
                  "boolean"
                ]
              },
              "type": "object"
            }
          },
          "type": "object"
        }
      },
      "type": "object"
    },
    "type": {
      "enum": [
        "deletion-request"
      ],
      "type": "string"
    },
    "version": {
      "maximum": 4,
      "minimum": 4,
      "type": "number"
    }
  },
  "required": [
    "application",
    "clientId",
    "creationDate",
    "id",
    "type",
    "version"
  ],
  "title": "deletion-request",
  "type": "object"
}
